root@lamp-ubuntu-s-1vcpu-1gb-tor1-01:~# tcpdump -n -i eth0
tcpdump: verbose output suppressed, use -v or -vv for full protocol decode
listening on eth0, link-type EN10MB (Ethernet), capture size 262144 bytes
07:14:16.555334 IP 76.64.103.178.51497 > 146.190.244.30.22: Flags [.], ack 1042432463, win 2047, options [nop,nop,TS val 2973854189 ecr 2845907207], length 0
07:14:16.556985 IP 146.190.244.30.22 > 76.64.103.178.51497: Flags [P.], seq 1:109, ack 0, win 501, options [nop,nop,TS val 2845907213 ecr 2973854189], length 108
07:14:16.557076 IP 146.190.244.30.22 > 76.64.103.178.51497: Flags [P.], seq 109:253, ack 0, win 501, options [nop,nop,TS val 2845907213 ecr 2973854189], length 144
07:14:16.557150 IP 146.190.244.30.22 > 76.64.103.178.51497: Flags [P.], seq 253:289, ack 0, win 501, options [nop,nop,TS val 2845907214 ecr 2973854189], length 36
07:14:16.557267 IP  146.190.244.30.22 > 76.64.103.178.51497: Flags [P.], seq 289:485, ack 0, win 501, options [nop,nop,TS val 2845907214 ecr 2973854189], length 196
07:14:16.557338 IP 146.190.244.30.22 > 76.64.103.178.51497: Flags [P.], seq 485:717, ack 0, win 501, options [nop,nop,TS val 2845907214 ecr 2973854189], length 232
07:14:16.557407 IP 146.190.244.30.22 > 76.64.103.178.51497: Flags [P.], seq 717:957, ack 0, win 501, options [nop,nop,TS val 2845907214 ecr 2973854189], length 240
07:14:16.557494 IP 146.190.244.30.22 > 76.64.103.178.51497: Flags [P.], seq 957:1189, ack 0, win 501, options [nop,nop,TS val 2845907214 ecr 2973854189], length 232
07:14:16.557554 IP 146.190.244.30.22 > 76.64.103.178.51497: Flags [P.], seq 1189:1429, ack 0, win 501, options [nop,nop,TS val 2845907214 ecr 2973854189], length 240
07:14:16.557620 IP 146.190.244.30.22 > 76.64.103.178.51497: Flags [P.], seq 1429:1465, ack 0, win 501, options [nop,nop,TS val 2845907214 ecr 2973854189], length 36
07:14:16.557634 IP 146.190.244.30.22 > 76.64.103.178.51497: Flags [P.], seq 1465:1669, ack 0, win 501, options [nop,nop,TS val 2845907214 ecr 2973854189], length 204
07:14:16.563426 IP 76.64.103.178.51497 > 146.190.244.30.22: Flags [.], ack 1189, win 2029, options [nop,nop,TS val 2973854197 ecr 2845907214], length 0
07:14:16.563426 IP 76.64.103.178.51497 > 146.190.244.30.22: Flags [.], ack 1669, win 2021, options [nop,nop,TS val 2973854197 ecr 2845907214], length 0
07:14:16.563495 IP 146.190.244.30.22 > 76.64.103.178.51497: Flags [P.], seq 1669:2905, ack 0, win 501, options [nop,nop,TS val 2845907220 ecr 2973854197], length 1236
07:14:16.563665 IP 146.190.244.30.22 > 76.64.103.178.51497: Flags [P.], seq 2905:3093, ack 0, win 501, options [nop,nop,TS val 2845907220 ecr 2973854197], length 188
07:14:16.563744 IP 146.190.244.30.22 > 76.64.103.178.51497: Flags [P.], seq 3093:3317, ack 0, win 501, options [nop,nop,TS val 2845907220 ecr 2973854197], length 224
07:14:16.563788 IP 146.190.244.30.22 > 76.64.103.178.51497: Flags [P.], seq 3317:3353, ack 0, win 501, options [nop,nop,TS val 2845907220 ecr 2973854197], length 36
07:14:16.563839 IP 146.190.244.30.22 > 76.64.103.178.51497: Flags [P.], seq 3353:3557, ack 0, win 501, options [nop,nop,TS val 2845907220 ecr 2973854197], length 204
07:14:16.563891 IP 146.190.244.30.22 > 76.64.103.178.51497: Flags [P.], seq 3557:3593, ack 0, win 501, options [nop,nop,TS val 2845907220 ecr 2973854197], length 36
07:14:16.563950 IP 146.190.244.30.22 > 76.64.103.178.51497: Flags [P.], seq 3593:3833, ack 0, win 501, options [nop,nop,TS val 2845907220 ecr 2973854197], length 240
07:14:16.563992 IP 146.190.244.30.22 > 76.64.103.178.51497: Flags [P.], seq 3833:4037, ack 0, win 501, options [nop,nop,TS val 2845907220 ecr 2973854197], length 204
07:14:16.564051 IP 146.190.244.30.22 > 76.64.103.178.51497: Flags [P.], seq 4037:4277, ack 0, win 501, options [nop,nop,TS val 2845907220 ecr 2973854197], length 240
07:14:16.564103 IP 146.190.244.30.22 > 76.64.103.178.51497: Flags [P.], seq 4277:4313, ack 0, win 501, options [nop,nop,TS val 2845907221 ecr 2973854197], length 36
07:14:16.564158 IP 146.190.244.30.22 > 76.64.103.178.51497: Flags [P.], seq 4313:4553, ack 0, win 501, options [nop,nop,TS val 2845907221 ecr 2973854197], length 240
07:14:16.564214 IP 146.190.244.30.22 > 76.64.103.178.51497: Flags [P.], seq 4553:4793, ack 0, win 501, options [nop,nop,TS val 2845907221 ecr 2973854197], length 240
07:14:16.564270 IP 146.190.244.30.22 > 76.64.103.178.51497: Flags [P.], seq 4793:5033, ack 0, win 501, options [nop,nop,TS val 2845907221 ecr 2973854197], length 240
07:14:16.564327 IP 146.190.244.30.22 > 76.64.103.178.51497: Flags [P.], seq 5033:5237, ack 0, win 501, options [nop,nop,TS val 2845907221 ecr 2973854197], length 204
07:14:16.564385 IP 146.190.244.30.22 > 76.64.103.178.51497: Flags [P.], seq 5237:5477, ack 0, win 501, options [nop,nop,TS val 2845907221 ecr 2973854197], length 240
07:14:16.564440 IP 146.190.244.30.22 > 76.64.103.178.51497: Flags [P.], seq 5477:5513, ack 0, win 501, options [nop,nop,TS val 2845907221 ecr 2973854197], length 36
07:14:16.564496 IP 146.190.244.30.22 > 76.64.103.178.51497: Flags [P.], seq 5513:5753, ack 0, win 501, options [nop,nop,TS val 2845907221 ecr 2973854197], length 240
07:14:16.564567 IP 146.190.244.30.22 > 76.64.103.178.51497: Flags [P.], seq 5753:5993, ack 0, win 501, options [nop,nop,TS val 2845907221 ecr 2973854197], length 240
07:14:16.564625 IP 146.190.244.30.22 > 76.64.103.178.51497: Flags [P.], seq 5993:6233, ack 0, win 501, options [nop,nop,TS val 2845907221 ecr 2973854197], length 240
07:14:16.564682 IP 146.190.244.30.22 > 76.64.103.178.51497: Flags [P.], seq 6233:6473, ack 0, win 501, options [nop,nop,TS val 2845907221 ecr 2973854197], length 240
07:14:16.570369 IP 76.64.103.178.51497 > 146.190.244.30.22: Flags [.], ack 6473, win 1972, options [nop,nop,TS val 2973854204 ecr 2845907221], length 0
07:14:16.570455 IP 146.190.244.30.22 > 76.64.103.178.51497: Flags [P.], seq 6473:8153, ack 0, win 501, options [nop,nop,TS val 2845907227 ecr 2973854204], length 1680
07:14:16.570688 IP 146.190.244.30.22 > 76.64.103.178.51497: Flags [P.], seq 8153:8341, ack 0, win 501, options [nop,nop,TS val 2845907227 ecr 2973854204], length 188
07:14:16.570789 IP 146.190.244.30.22 > 76.64.103.178.51497: Flags [P.], seq 8341:8581, ack 0, win 501, options [nop,nop,TS val 2845907227 ecr 2973854204], length 240
07:14:16.570877 IP 146.190.244.30.22 > 76.64.103.178.51497: Flags [P.], seq 8581:8857, ack 0, win 501, options [nop,nop,TS val 2845907227 ecr 2973854204], length 276
07:14:16.571334 IP 76.64.103.178.51497 > 146.190.244.30.22: Flags [.], ack 6473, win 2048, options [nop,nop,TS val 2973854204 ecr 2845907221], length 0
07:14:16.571362 IP 146.190.244.30.22 > 76.64.103.178.51497: Flags [P.], seq 8857:9337, ack 0, win 501, options [nop,nop,TS val 2845907228 ecr 2973854204], length 480
07:14:16.571480 IP 146.190.244.30.22 > 76.64.103.178.51497: Flags [P.], seq 9337:9525, ack 0, win 501, options [nop,nop,TS val 2845907228 ecr 2973854204], length 188
07:14:16.571528 IP 146.190.244.30.22 > 76.64.103.178.51497: Flags [P.], seq 9525:9765, ack 0, win 501, options [nop,nop,TS val 2845907228 ecr 2973854204], length 240
07:14:16.571606 IP 146.190.244.30.22 > 76.64.103.178.51497: Flags [P.], seq 9765:10005, ack 0, win 501, options [nop,nop,TS val 2845907228 ecr 2973854204], length 240
07:14:16.571682 IP 146.190.244.30.22 > 76.64.103.178.51497: Flags [P.], seq 10005:10245, ack 0, win 501, options [nop,nop,TS val 2845907228 ecr 2973854204], length 240
07:14:16.571747 IP 146.190.244.30.22 > 76.64.103.178.51497: Flags [P.], seq 10245:10521, ack 0, win 501, options [nop,nop,TS val 2845907228 ecr 2973854204], length 276
07:14:16.571816 IP 146.190.244.30.22 > 76.64.103.178.51497: Flags [P.], seq 10521:10761, ack 0, win 501, options [nop,nop,TS val 2845907228 ecr 2973854204], length 240
07:14:16.571894 IP 146.190.244.30.22 > 76.64.103.178.51497: Flags [P.], seq 10761:11001, ack 0, win 501, options [nop,nop,TS val 2845907228 ecr 2973854204], length 240
07:14:16.571968 IP 146.190.244.30.22 > 76.64.103.178.51497: Flags [P.], seq 11001:11241, ack 0, win 501, options [nop,nop,TS val 2845907228 ecr 2973854204], length 240
07:14:16.572039 IP 146.190.244.30.22 > 76.64.103.178.51497: Flags [P.], seq 11241:11481, ack 0, win 501, options [nop,nop,TS val 2845907228 ecr 2973854204], length 240
07:14:16.572099 IP 146.190.244.30.22 > 76.64.103.178.51497: Flags [P.], seq 11481:11721, ack 0, win 501, options [nop,nop,TS val 2845907229 ecr 2973854204], length 240
07:14:16.572160 IP 146.190.244.30.22 > 76.64.103.178.51497: Flags [P.], seq 11721:11925, ack 0, win 501, options [nop,nop,TS val 2845907229 ecr 2973854204], length 204
07:14:16.572202 IP 146.190.244.30.22 > 76.64.103.178.51497: Flags [P.], seq 11925:12165, ack 0, win 501, options [nop,nop,TS val 2845907229 ecr 2973854204], length 240
07:14:16.572247 IP 146.190.244.30.22 > 76.64.103.178.51497: Flags [P.], seq 12165:12201, ack 0, win 501, options [nop,nop,TS val 2845907229 ecr 2973854204], length 36
07:14:16.572314 IP 146.190.244.30.22 > 76.64.103.178.51497: Flags [P.], seq 12201:12645, ack 0, win 501, options [nop,nop,TS val 2845907229 ecr 2973854204], length 444
07:14:16.572387 IP 146.190.244.30.22 > 76.64.103.178.51497: Flags [P.], seq 12645:13125, ack 0, win 501, options [nop,nop,TS val 2845907229 ecr 2973854204], length 480
07:14:16.572448 IP 146.190.244.30.22 > 76.64.103.178.51497: Flags [P.], seq 13125:13365, ack 0, win 501, options [nop,nop,TS val 2845907229 ecr 2973854204], length 240
07:14:16.572510 IP 146.190.244.30.22 > 76.64.103.178.51497: Flags [P.], seq 13365:13605, ack 0, win 501, options [nop,nop,TS val 2845907229 ecr 2973854204], length 240
07:14:16.572571 IP 146.190.244.30.22 > 76.64.103.178.51497: Flags [P.], seq 13605:13641, ack 0, win 501, options [nop,nop,TS val 2845907229 ecr 2973854204], length 36
07:14:16.572631 IP 146.190.244.30.22 > 76.64.103.178.51497: Flags [P.], seq 13641:14085, ack 0, win 501, options [nop,nop,TS val 2845907229 ecr 2973854204], length 444
07:14:16.572710 IP 146.190.244.30.22 > 76.64.103.178.51497: Flags [P.], seq 14085:14361, ack 0, win 501, options [nop,nop,TS val 2845907229 ecr 2973854204], length 276
07:14:16.572760 IP 146.190.244.30.22 > 76.64.103.178.51497: Flags [P.], seq 14361:14601, ack 0, win 501, options [nop,nop,TS val 2845907229 ecr 2973854204], length 240
07:14:16.572821 IP 146.190.244.30.22 > 76.64.103.178.51497: Flags [P.], seq 14601:14841, ack 0, win 501, options [nop,nop,TS val 2845907229 ecr 2973854204], length 240
07:14:16.572884 IP 146.190.244.30.22 > 76.64.103.178.51497: Flags [P.], seq 14841:15081, ack 0, win 501, options [nop,nop,TS val 2845907229 ecr 2973854204], length 240
07:14:16.572949 IP 146.190.244.30.22 > 76.64.103.178.51497: Flags [P.], seq 15081:15321, ack 0, win 501, options [nop,nop,TS val 2845907229 ecr 2973854204], length 240
07:14:16.573012 IP 146.190.244.30.22 > 76.64.103.178.51497: Flags [P.], seq 15321:15525, ack 0, win 501, options [nop,nop,TS val 2845907229 ecr 2973854204], length 204
07:14:16.573067 IP 146.190.244.30.22 > 76.64.103.178.51497: Flags [P.], seq 15525:15765, ack 0, win 501, options [nop,nop,TS val 2845907229 ecr 2973854204], length 240
07:14:16.573122 IP 146.190.244.30.22 > 76.64.103.178.51497: Flags [P.], seq 15765:15801, ack 0, win 501, options [nop,nop,TS val 2845907230 ecr 2973854204], length 36
07:14:16.573178 IP 146.190.244.30.22 > 76.64.103.178.51497: Flags [P.], seq 15801:16041, ack 0, win 501, options [nop,nop,TS val 2845907230 ecr 2973854204], length 240
07:14:16.573233 IP 146.190.244.30.22 > 76.64.103.178.51497: Flags [P.], seq 16041:16281, ack 0, win 501, options [nop,nop,TS val 2845907230 ecr 2973854204], length 240
07:14:16.573289 IP 146.190.244.30.22 > 76.64.103.178.51497: Flags [P.], seq 16281:16521, ack 0, win 501, options [nop,nop,TS val 2845907230 ecr 2973854204], length 240
07:14:16.573345 IP 146.190.244.30.22 > 76.64.103.178.51497: Flags [P.], seq 16521:16725, ack 0, win 501, options [nop,nop,TS val 2845907230 ecr 2973854204], length 204
07:14:16.573399 IP 146.190.244.30.22 > 76.64.103.178.51497: Flags [P.], seq 16725:16965, ack 0, win 501, options [nop,nop,TS val 2845907230 ecr 2973854204], length 240
07:14:16.573450 IP 146.190.244.30.22 > 76.64.103.178.51497: Flags [P.], seq 16965:17001, ack 0, win 501, options [nop,nop,TS val 2845907230 ecr 2973854204], length 36
07:14:16.573508 IP 146.190.244.30.22 > 76.64.103.178.51497: Flags [P.], seq 17001:17241, ack 0, win 501, options [nop,nop,TS val 2845907230 ecr 2973854204], length 240
07:14:16.577395 IP 76.64.103.178.51497 > 146.190.244.30.22: Flags [.], ack 9525, win 2000, options [nop,nop,TS val 2973854210 ecr 2845907228], length 0
07:14:16.577396 IP 76.64.103.178.51497 > 146.190.244.30.22: Flags [.], ack 9525, win 2048, options [nop,nop,TS val 2973854210 ecr 2845907228], length 0
07:14:16.577396 IP 76.64.103.178.51497 > 146.190.244.30.22: Flags [.], ack 17001, win 1931, options [nop,nop,TS val 2973854211 ecr 2845907230], length 0
07:14:16.577396 IP 76.64.103.178.51497 > 146.190.244.30.22: Flags [.], ack 17001, win 2048, options [nop,nop,TS val 2973854211 ecr 2845907230], length 0
07:14:16.577462 IP 146.190.244.30.22 > 76.64.103.178.51497: Flags [P.], seq 17241:17961, ack 0, win 501, options [nop,nop,TS val 2845907234 ecr 2973854210], length 720
07:14:16.577652 IP 146.190.244.30.22 > 76.64.103.178.51497: Flags [P.], seq 17961:18149, ack 0, win 501, options [nop,nop,TS val 2845907234 ecr 2973854211], length 188
07:14:16.577725 IP 146.190.244.30.22 > 76.64.103.178.51497: Flags [P.], seq 18149:18185, ack 0, win 501, options [nop,nop,TS val 2845907234 ecr 2973854211], length 36
07:14:16.577741 IP 146.190.244.30.22 > 76.64.103.178.51497: Flags [P.], seq 18185:18373, ack 0, win 501, options [nop,nop,TS val 2845907234 ecr 2973854211], length 188
07:14:16.577793 IP 146.190.244.30.22 > 76.64.103.178.51497: Flags [P.], seq 18373:18409, ack 0, win 501, options [nop,nop,TS val 2845907234 ecr 2973854211], length 36
07:14:16.577846 IP 146.190.244.30.22 > 76.64.103.178.51497: Flags [P.], seq 18409:18633, ack 0, win 501, options [nop,nop,TS val 2845907234 ecr 2973854211], length 224
07:14:16.577898 IP 146.190.244.30.22 > 76.64.103.178.51497: Flags [P.], seq 18633:18821, ack 0, win 501, options [nop,nop,TS val 2845907234 ecr 2973854211], length 188
07:14:16.577944 IP 146.190.244.30.22 > 76.64.103.178.51497: Flags [P.], seq 18821:18857, ack 0, win 501, options [nop,nop,TS val 2845907234 ecr 2973854211], length 36
07:14:16.577991 IP 146.190.244.30.22 > 76.64.103.178.51497: Flags [P.], seq 18857:19097, ack 0, win 501, options [nop,nop,TS val 2845907234 ecr 2973854211], length 240
07:14:16.578041 IP 146.190.244.30.22 > 76.64.103.178.51497: Flags [P.], seq 19097:19301, ack 0, win 501, options [nop,nop,TS val 2845907234 ecr 2973854211], length 204
07:14:16.578096 IP 146.190.244.30.22 > 76.64.103.178.51497: Flags [P.], seq 19301:19541, ack 0, win 501, options [nop,nop,TS val 2845907235 ecr 2973854211], length 240
07:14:16.578147 IP 146.190.244.30.22 > 76.64.103.178.51497: Flags [P.], seq 19541:19577, ack 0, win 501, options [nop,nop,TS val 2845907235 ecr 2973854211], length 36
07:14:16.578192 IP 146.190.244.30.22 > 76.64.103.178.51497: Flags [P.], seq 19577:19817, ack 0, win 501, options [nop,nop,TS val 2845907235 ecr 2973854211], length 240
07:14:16.578237 IP 146.190.244.30.22 > 76.64.103.178.51497: Flags [P.], seq 19817:20021, ack 0, win 501, options [nop,nop,TS val 2845907235 ecr 2973854211], length 204
07:14:16.578297 IP 146.190.244.30.22 > 76.64.103.178.51497: Flags [P.], seq 20021:20261, ack 0, win 501, options [nop,nop,TS val 2845907235 ecr 2973854211], length 240
07:14:16.578355 IP 146.190.244.30.22 > 76.64.103.178.51497: Flags [P.], seq 20261:20297, ack 0, win 501, options [nop,nop,TS val 2845907235 ecr 2973854211], length 36
07:14:16.578418 IP 146.190.244.30.22 > 76.64.103.178.51497: Flags [P.], seq 20297:20537, ack 0, win 501, options [nop,nop,TS val 2845907235 ecr 2973854211], length 240
07:14:16.578472 IP 146.190.244.30.22 > 76.64.103.178.51497: Flags [P.], seq 20537:20741, ack 0, win 501, options [nop,nop,TS val 2845907235 ecr 2973854211], length 204
07:14:16.578539 IP 146.190.244.30.22 > 76.64.103.178.51497: Flags [P.], seq 20741:20981, ack 0, win 501, options [nop,nop,TS val 2845907235 ecr 2973854211], length 240
07:14:16.578592 IP 146.190.244.30.22 > 76.64.103.178.51497: Flags [P.], seq 20981:21221, ack 0, win 501, options [nop,nop,TS val 2845907235 ecr 2973854211], length 240
07:14:16.578646 IP 146.190.244.30.22 > 76.64.103.178.51497: Flags [P.], seq 21221:21257, ack 0, win 501, options [nop,nop,TS val 2845907235 ecr 2973854211], length 36
07:14:16.578703 IP 146.190.244.30.22 > 76.64.103.178.51497: Flags [P.], seq 21257:21497, ack 0, win 501, options [nop,nop,TS val 2845907235 ecr 2973854211], length 240
07:14:16.578755 IP 146.190.244.30.22 > 76.64.103.178.51497: Flags [P.], seq 21497:21737, ack 0, win 501, options [nop,nop,TS val 2845907235 ecr 2973854211], length 240
07:14:16.578808 IP 146.190.244.30.22 > 76.64.103.178.51497: Flags [P.], seq 21737:21941, ack 0, win 501, options [nop,nop,TS val 2845907235 ecr 2973854211], length 204
07:14:16.578865 IP 146.190.244.30.22 > 76.64.103.178.51497: Flags [P.], seq 21941:22181, ack 0, win 501, options [nop,nop,TS val 2845907235 ecr 2973854211], length 240
07:14:16.578917 IP 146.190.244.30.22 > 76.64.103.178.51497: Flags [P.], seq 22181:22421, ack 0, win 501, options [nop,nop,TS val 2845907235 ecr 2973854211], length 240
07:14:16.578963 IP 146.190.244.30.22 > 76.64.103.178.51497: Flags [P.], seq 22421:22457, ack 0, win 501, options [nop,nop,TS val 2845907235 ecr 2973854211], length 36
07:14:16.579361 IP 146.190.244.30.22 > 76.64.103.178.51497: Flags [P.], seq 22457:23381, ack 0, win 501, options [nop,nop,TS val 2845907236 ecr 2973854211], length 924
07:14:16.579425 IP 146.190.244.30.22 > 76.64.103.178.51497: Flags [P.], seq 23381:23621, ack 0, win 501, options [nop,nop,TS val 2845907236 ecr 2973854211], length 240
07:14:16.579480 IP 146.190.244.30.22 > 76.64.103.178.51497: Flags [P.], seq 23621:23657, ack 0, win 501, options [nop,nop,TS val 2845907236 ecr 2973854211], length 36
07:14:16.579535 IP 146.190.244.30.22 > 76.64.103.178.51497: Flags [P.], seq 23657:23897, ack 0, win 501, options [nop,nop,TS val 2845907236 ecr 2973854211], length 240
07:14:16.579591 IP 146.190.244.30.22 > 76.64.103.178.51497: Flags [P.], seq 23897:24101, ack 0, win 501, options [nop,nop,TS val 2845907236 ecr 2973854211], length 204
07:14:16.579651 IP 146.190.244.30.22 > 76.64.103.178.51497: Flags [P.], seq 24101:24341, ack 0, win 501, options [nop,nop,TS val 2845907236 ecr 2973854211], length 240
07:14:16.579720 IP 146.190.244.30.22 > 76.64.103.178.51497: Flags [P.], seq 24341:24581, ack 0, win 501, options [nop,nop,TS val 2845907236 ecr 2973854211], length 240
07:14:16.579774 IP 146.190.244.30.22 > 76.64.103.178.51497: Flags [P.], seq 24581:24821, ack 0, win 501, options [nop,nop,TS val 2845907236 ecr 2973854211], length 240
07:14:16.579830 IP 146.190.244.30.22 > 76.64.103.178.51497: Flags [P.], seq 24821:24857, ack 0, win 501, options [nop,nop,TS val 2845907236 ecr 2973854211], length 36
07:14:16.579893 IP 146.190.244.30.22 > 76.64.103.178.51497: Flags [P.], seq 24857:25097, ack 0, win 501, options [nop,nop,TS val 2845907236 ecr 2973854211], length 240
07:14:16.579941 IP 146.190.244.30.22 > 76.64.103.178.51497: Flags [P.], seq 25097:25301, ack 0, win 501, options [nop,nop,TS val 2845907236 ecr 2973854211], length 204
07:14:16.579998 IP 146.190.244.30.22 > 76.64.103.178.51497: Flags [P.], seq 25301:25541, ack 0, win 501, options [nop,nop,TS val 2845907236 ecr 2973854211], length 240
07:14:16.580047 IP 146.190.244.30.22 > 76.64.103.178.51497: Flags [P.], seq 25541:25577, ack 0, win 501, options [nop,nop,TS val 2845907236 ecr 2973854211], length 36
07:14:16.580093 IP 146.190.244.30.22 > 76.64.103.178.51497: Flags [P.], seq 25577:25781, ack 0, win 501, options [nop,nop,TS val 2845907236 ecr 2973854211], length 204
07:14:16.580138 IP 146.190.244.30.22 > 76.64.103.178.51497: Flags [P.], seq 25781:25817, ack 0, win 501, options [nop,nop,TS val 2845907237 ecr 2973854211], length 36
07:14:16.580183 IP 146.190.244.30.22 > 76.64.103.178.51497: Flags [P.], seq 25817:26057, ack 0, win 501, options [nop,nop,TS val 2845907237 ecr 2973854211], length 240
07:14:16.580230 IP 146.190.244.30.22 > 76.64.103.178.51497: Flags [P.], seq 26057:26261, ack 0, win 501, options [nop,nop,TS val 2845907237 ecr 2973854211], length 204
07:14:16.580275 IP 146.190.244.30.22 > 76.64.103.178.51497: Flags [P.], seq 26261:26297, ack 0, win 501, options [nop,nop,TS val 2845907237 ecr 2973854211], length 36
07:14:16.580324 IP 146.190.244.30.22 > 76.64.103.178.51497: Flags [P.], seq 26297:26501, ack 0, win 501, options [nop,nop,TS val 2845907237 ecr 2973854211], length 204
07:14:16.580336 IP 76.64.103.178.51497 > 146.190.244.30.22: Flags [.], ack 17241, win 2044, options [nop,nop,TS val 2973854213 ecr 2845907230], length 0
07:14:16.580374 IP 146.190.244.30.22 > 76.64.103.178.51497: Flags [P.], seq 26501:26537, ack 0, win 501, options [nop,nop,TS val 2845907237 ecr 2973854213], length 36
07:14:16.580424 IP 146.190.244.30.22 > 76.64.103.178.51497: Flags [P.], seq 26537:26741, ack 0, win 501, options [nop,nop,TS val 2845907237 ecr 2973854213], length 204
07:14:16.580471 IP 146.190.244.30.22 > 76.64.103.178.51497: Flags [P.], seq 26741:26777, ack 0, win 501, options [nop,nop,TS val 2845907237 ecr 2973854213], length 36
07:14:16.580520 IP 146.190.244.30.22 > 76.64.103.178.51497: Flags [P.], seq 26777:26981, ack 0, win 501, options [nop,nop,TS val 2845907237 ecr 2973854213], length 204
07:14:16.580569 IP 146.190.244.30.22 > 76.64.103.178.51497: Flags [P.], seq 26981:27017, ack 0, win 501, options [nop,nop,TS val 2845907237 ecr 2973854213], length 36
07:14:16.580620 IP 146.190.244.30.22 > 76.64.103.178.51497: Flags [P.], seq 27017:27257, ack 0, win 501, options [nop,nop,TS val 2845907237 ecr 2973854213], length 240
07:14:16.580670 IP 146.190.244.30.22 > 76.64.103.178.51497: Flags [P.], seq 27257:27461, ack 0, win 501, options [nop,nop,TS val 2845907237 ecr 2973854213], length 204
07:14:16.580716 IP 146.190.244.30.22 > 76.64.103.178.51497: Flags [P.], seq 27461:27497, ack 0, win 501, options [nop,nop,TS val 2845907237 ecr 2973854213], length 36
07:14:16.580762 IP 146.190.244.30.22 > 76.64.103.178.51497: Flags [P.], seq 27497:27737, ack 0, win 501, options [nop,nop,TS val 2845907237 ecr 2973854213], length 240
07:14:16.580809 IP 146.190.244.30.22 > 76.64.103.178.51497: Flags [P.], seq 27737:27941, ack 0, win 501, options [nop,nop,TS val 2845907237 ecr 2973854213], length 204
07:14:16.580860 IP 146.190.244.30.22 > 76.64.103.178.51497: Flags [P.], seq 27941:27977, ack 0, win 501, options [nop,nop,TS val 2845907237 ecr 2973854213], length 36
07:14:16.580909 IP 146.190.244.30.22 > 76.64.103.178.51497: Flags [P.], seq 27977:28217, ack 0, win 501, options [nop,nop,TS val 2845907237 ecr 2973854213], length 240
07:14:16.580954 IP 146.190.244.30.22 > 76.64.103.178.51497: Flags [P.], seq 28217:28421, ack 0, win 501, options [nop,nop,TS val 2845907237 ecr 2973854213], length 204
07:14:16.581000 IP 146.190.244.30.22 > 76.64.103.178.51497: Flags [P.], seq 28421:28457, ack 0, win 501, options [nop,nop,TS val 2845907237 ecr 2973854213], length 36
07:14:16.581046 IP 146.190.244.30.22 > 76.64.103.178.51497: Flags [P.], seq 28457:28661, ack 0, win 501, options [nop,nop,TS val 2845907237 ecr 2973854213], length 204
07:14:16.581091 IP 146.190.244.30.22 > 76.64.103.178.51497: Flags [P.], seq 28661:28697, ack 0, win 501, options [nop,nop,TS val 2845907237 ecr 2973854213], length 36
07:14:16.581137 IP 146.190.244.30.22 > 76.64.103.178.51497: Flags [P.], seq 28697:28901, ack 0, win 501, options [nop,nop,TS val 2845907238 ecr 2973854213], length 204
07:14:16.581183 IP 146.190.244.30.22 > 76.64.103.178.51497: Flags [P.], seq 28901:28937, ack 0, win 501, options [nop,nop,TS val 2845907238 ecr 2973854213], length 36
07:14:16.581235 IP 146.190.244.30.22 > 76.64.103.178.51497: Flags [P.], seq 28937:29309, ack 0, win 501, options [nop,nop,TS val 2845907238 ecr 2973854213], length 372
07:14:16.581321 IP 146.190.244.30.22 > 76.64.103.178.51497: Flags [P.], seq 29309:29513, ack 0, win 501, options [nop,nop,TS val 2845907238 ecr 2973854213], length 204
07:14:16.581335 IP 76.64.103.178.51497 > 146.190.244.30.22: Flags [.], ack 17961, win 2036, options [nop,nop,TS val 2973854215 ecr 2845907234], length 0
07:14:16.581374 IP 146.190.244.30.22 > 76.64.103.178.51497: Flags [P.], seq 29513:30037, ack 0, win 501, options [nop,nop,TS val 2845907238 ecr 2973854215], length 524
07:14:16.581430 IP 146.190.244.30.22 > 76.64.103.178.51497: Flags [P.], seq 30037:30073, ack 0, win 501, options [nop,nop,TS val 2845907238 ecr 2973854215], length 36
07:14:16.581471 IP 146.190.244.30.22 > 76.64.103.178.51497: Flags [P.], seq 30073:30445, ack 0, win 501, options [nop,nop,TS val 2845907238 ecr 2973854215], length 372
07:14:16.581549 IP 146.190.244.30.22 > 76.64.103.178.51497: Flags [P.], seq 30445:30649, ack 0, win 501, options [nop,nop,TS val 2845907238 ecr 2973854215], length 204
07:14:16.581588 IP 146.190.244.30.22 > 76.64.103.178.51497: Flags [P.], seq 30649:31021, ack 0, win 501, options [nop,nop,TS val 2845907238 ecr 2973854215], length 372
07:14:16.581655 IP 146.190.244.30.22 > 76.64.103.178.51497: Flags [P.], seq 31021:31225, ack 0, win 501, options [nop,nop,TS val 2845907238 ecr 2973854215], length 204
07:14:16.581715 IP 146.190.244.30.22 > 76.64.103.178.51497: Flags [P.], seq 31225:31429, ack 0, win 501, options [nop,nop,TS val 2845907238 ecr 2973854215], length 204
07:14:16.581782 IP 146.190.244.30.22 > 76.64.103.178.51497: Flags [P.], seq 31429:31633, ack 0, win 501, options [nop,nop,TS val 2845907238 ecr 2973854215], length 204
07:14:16.581822 IP 146.190.244.30.22 > 76.64.103.178.51497: Flags [P.], seq 31633:32005, ack 0, win 501, options [nop,nop,TS val 2845907238 ecr 2973854215], length 372
07:14:16.581892 IP 146.190.244.30.22 > 76.64.103.178.51497: Flags [P.], seq 32005:32209, ack 0, win 501, options [nop,nop,TS val 2845907238 ecr 2973854215], length 204
07:14:16.581938 IP 146.190.244.30.22 > 76.64.103.178.51497: Flags [P.], seq 32209:32581, ack 0, win 501, options [nop,nop,TS val 2845907238 ecr 2973854215], length 372
07:14:16.582027 IP 146.190.244.30.22 > 76.64.103.178.51497: Flags [P.], seq 32581:33121, ack 0, win 501, options [nop,nop,TS val 2845907238 ecr 2973854215], length 540
07:14:16.582125 IP 146.190.244.30.22 > 76.64.103.178.51497: Flags [P.], seq 33121:33821, ack 0, win 501, options [nop,nop,TS val 2845907239 ecr 2973854215], length 700
07:14:16.582209 IP 146.190.244.30.22 > 76.64.103.178.51497: Flags [P.], seq 33821:34361, ack 0, win 501, options [nop,nop,TS val 2845907239 ecr 2973854215], length 540
07:14:16.582296 IP 146.190.244.30.22 > 76.64.103.178.51497: Flags [P.], seq 34361:34909, ack 0, win 501, options [nop,nop,TS val 2845907239 ecr 2973854215], length 548
07:14:16.582389 IP 146.190.244.30.22 > 76.64.103.178.51497: Flags [P.], seq 34909:35617, ack 0, win 501, options [nop,nop,TS val 2845907239 ecr 2973854215], length 708
07:14:16.584429 IP 76.64.103.178.51497 > 146.190.244.30.22: Flags [.], ack 23657, win 1959, options [nop,nop,TS val 2973854218 ecr 2845907236], length 0
07:14:16.584430 IP 76.64.103.178.51497 > 146.190.244.30.22: Flags [.], ack 23657, win 2048, options [nop,nop,TS val 2973854218 ecr 2845907236], length 0
07:14:16.584500 IP 146.190.244.30.22 > 76.64.103.178.51497: Flags [P.], seq 35617:36821, ack 0, win 501, options [nop,nop,TS val 2845907241 ecr 2973854218], length 1204
07:14:16.584668 IP 146.190.244.30.22 > 76.64.103.178.51497: Flags [P.], seq 36821:37009, ack 0, win 501, options [nop,nop,TS val 2845907241 ecr 2973854218], length 188
07:14:16.584752 IP 146.190.244.30.22 > 76.64.103.178.51497: Flags [P.], seq 37009:37045, ack 0, win 501, options [nop,nop,TS val 2845907241 ecr 2973854218], length 36
07:14:16.584801 IP 146.190.244.30.22 > 76.64.103.178.51497: Flags [P.], seq 37045:37233, ack 0, win 501, options [nop,nop,TS val 2845907241 ecr 2973854218], length 188
07:14:16.584885 IP 146.190.244.30.22 > 76.64.103.178.51497: Flags [P.], seq 37233:37473, ack 0, win 501, options [nop,nop,TS val 2845907241 ecr 2973854218], length 240
07:14:16.584944 IP 146.190.244.30.22 > 76.64.103.178.51497: Flags [P.], seq 37473:37713, ack 0, win 501, options [nop,nop,TS val 2845907241 ecr 2973854218], length 240
07:14:16.585019 IP 146.190.244.30.22 > 76.64.103.178.51497: Flags [P.], seq 37713:37749, ack 0, win 501, options [nop,nop,TS val 2845907241 ecr 2973854218], length 36
07:14:16.585076 IP 146.190.244.30.22 > 76.64.103.178.51497: Flags [P.], seq 37749:38289, ack 0, win 501, options [nop,nop,TS val 2845907241 ecr 2973854218], length 540
07:14:16.585277 IP 146.190.244.30.22 > 76.64.103.178.51497: Flags [P.], seq 38289:38865, ack 0, win 501, options [nop,nop,TS val 2845907242 ecr 2973854218], length 576
07:14:16.585425 IP 146.190.244.30.22 > 76.64.103.178.51497: Flags [P.], seq 38865:39069, ack 0, win 501, options [nop,nop,TS val 2845907242 ecr 2973854218], length 204
07:14:16.585492 IP 146.190.244.30.22 > 76.64.103.178.51497: Flags [P.], seq 39069:39309, ack 0, win 501, options [nop,nop,TS val 2845907242 ecr 2973854218], length 240
07:14:16.585572 IP 146.190.244.30.22 > 76.64.103.178.51497: Flags [P.], seq 39309:39513, ack 0, win 501, options [nop,nop,TS val 2845907242 ecr 2973854218], length 204
07:14:16.585714 IP 146.190.244.30.22 > 76.64.103.178.51497: Flags [P.], seq 39513:39717, ack 0, win 501, options [nop,nop,TS val 2845907242 ecr 2973854218], length 204
07:14:16.585893 IP 146.190.244.30.22 > 76.64.103.178.51497: Flags [P.], seq 39717:39921, ack 0, win 501, options [nop,nop,TS val 2845907242 ecr 2973854218], length 204
07:14:16.585996 IP 146.190.244.30.22 > 76.64.103.178.51497: Flags [P.], seq 39921:40125, ack 0, win 501, options [nop,nop,TS val 2845907242 ecr 2973854218], length 204
07:14:16.586060 IP 146.190.244.30.22 > 76.64.103.178.51497: Flags [P.], seq 40125:40337, ack 0, win 501, options [nop,nop,TS val 2845907242 ecr 2973854218], length 212
07:14:16.586121 IP 146.190.244.30.22 > 76.64.103.178.51497: Flags [P.], seq 40337:40541, ack 0, win 501, options [nop,nop,TS val 2845907243 ecr 2973854218], length 204
07:14:16.586185 IP 146.190.244.30.22 > 76.64.103.178.51497: Flags [P.], seq 40541:40745, ack 0, win 501, options [nop,nop,TS val 2845907243 ecr 2973854218], length 204
07:14:16.586356 IP 146.190.244.30.22 > 76.64.103.178.51497: Flags [P.], seq 40745:40949, ack 0, win 501, options [nop,nop,TS val 2845907243 ecr 2973854218], length 204
07:14:16.586563 IP 146.190.244.30.22 > 76.64.103.178.51497: Flags [P.], seq 40949:41153, ack 0, win 501, options [nop,nop,TS val 2845907243 ecr 2973854218], length 204
07:14:16.586652 IP 146.190.244.30.22 > 76.64.103.178.51497: Flags [P.], seq 41153:41357, ack 0, win 501, options [nop,nop,TS val 2845907243 ecr 2973854218], length 204
07:14:16.586789 IP 146.190.244.30.22 > 76.64.103.178.51497: Flags [P.], seq 41357:41561, ack 0, win 501, options [nop,nop,TS val 2845907243 ecr 2973854218], length 204
07:14:16.586930 IP 146.190.244.30.22 > 76.64.103.178.51497: Flags [P.], seq 41561:41765, ack 0, win 501, options [nop,nop,TS val 2845907243 ecr 2973854218], length 204
07:14:16.587274 IP 146.190.244.30.22 > 76.64.103.178.51497: Flags [P.], seq 41765:41969, ack 0, win 501, options [nop,nop,TS val 2845907244 ecr 2973854218], length 204
07:14:16.587314 IP 76.64.103.178.51497 > 146.190.244.30.22: Flags [.], ack 28697, win 2048, options [nop,nop,TS val 2973854219 ecr 2845907237], length 0
07:14:16.587314 IP 76.64.103.178.51497 > 146.190.244.30.22: Flags [.], ack 30445, win 2020, options [nop,nop,TS val 2973854219 ecr 2845907238], length 0
07:14:16.587453 IP 146.190.244.30.22 > 76.64.103.178.51497: Flags [P.], seq 41969:42173, ack 0, win 501, options [nop,nop,TS val 2845907244 ecr 2973854219], length 204
07:14:16.587553 IP 146.190.244.30.22 > 76.64.103.178.51497: Flags [P.], seq 42173:42689, ack 0, win 501, options [nop,nop,TS val 2845907244 ecr 2973854219], length 516
07:14:16.587625 IP 146.190.244.30.22 > 76.64.103.178.51497: Flags [P.], seq 42689:42893, ack 0, win 501, options [nop,nop,TS val 2845907244 ecr 2973854219], length 204
07:14:16.587694 IP 146.190.244.30.22 > 76.64.103.178.51497: Flags [P.], seq 42893:43097, ack 0, win 501, options [nop,nop,TS val 2845907244 ecr 2973854219], length 204
07:14:16.587763 IP 146.190.244.30.22 > 76.64.103.178.51497: Flags [P.], seq 43097:43301, ack 0, win 501, options [nop,nop,TS val 2845907244 ecr 2973854219], length 204
07:14:16.587832 IP 146.190.244.30.22 > 76.64.103.178.51497: Flags [P.], seq 43301:43505, ack 0, win 501, options [nop,nop,TS val 2845907244 ecr 2973854219], length 204
07:14:16.588042 IP 146.190.244.30.22 > 76.64.103.178.51497: Flags [P.], seq 43505:43709, ack 0, win 501, options [nop,nop,TS val 2845907244 ecr 2973854219], length 204
07:14:16.588159 IP 146.190.244.30.22 > 76.64.103.178.51497: Flags [P.], seq 43709:43913, ack 0, win 501, options [nop,nop,TS val 2845907245 ecr 2973854219], length 204
07:14:16.588212 IP 146.190.244.30.22 > 76.64.103.178.51497: Flags [P.], seq 43913:44125, ack 0, win 501, options [nop,nop,TS val 2845907245 ecr 2973854219], length 212
07:14:16.588263 IP 146.190.244.30.22 > 76.64.103.178.51497: Flags [P.], seq 44125:44329, ack 0, win 501, options [nop,nop,TS val 2845907245 ecr 2973854219], length 204
07:14:16.588329 IP 146.190.244.30.22 > 76.64.103.178.51497: Flags [P.], seq 44329:44533, ack 0, win 501, options [nop,nop,TS val 2845907245 ecr 2973854219], length 204
07:14:16.588382 IP 146.190.244.30.22 > 76.64.103.178.51497: Flags [P.], seq 44533:44737, ack 0, win 501, options [nop,nop,TS val 2845907245 ecr 2973854219], length 204
07:14:16.588398 IP 76.64.103.178.51497 > 146.190.244.30.22: Flags [.], ack 35617, win 1967, options [nop,nop,TS val 2973854222 ecr 2845907239], length 0
07:14:16.588398 IP 76.64.103.178.51497 > 146.190.244.30.22: Flags [.], ack 35617, win 2048, options [nop,nop,TS val 2973854222 ecr 2845907239], length 0
07:14:16.588487 IP 146.190.244.30.22 > 76.64.103.178.51497: Flags [P.], seq 44737:45253, ack 0, win 501, options [nop,nop,TS val 2845907245 ecr 2973854222], length 516
07:14:16.588567 IP 146.190.244.30.22 > 76.64.103.178.51497: Flags [P.], seq 45253:45457, ack 0, win 501, options [nop,nop,TS val 2845907245 ecr 2973854222], length 204
07:14:16.588697 IP 146.190.244.30.22 > 76.64.103.178.51497: Flags [P.], seq 45457:45661, ack 0, win 501, options [nop,nop,TS val 2845907245 ecr 2973854222], length 204
07:14:16.588772 IP 146.190.244.30.22 > 76.64.103.178.51497: Flags [P.], seq 45661:45865, ack 0, win 501, options [nop,nop,TS val 2845907245 ecr 2973854222], length 204
07:14:16.588953 IP 146.190.244.30.22 > 76.64.103.178.51497: Flags [P.], seq 45865:46069, ack 0, win 501, options [nop,nop,TS val 2845907245 ecr 2973854222], length 204
07:14:16.589073 IP 146.190.244.30.22 > 76.64.103.178.51497: Flags [P.], seq 46069:46273, ack 0, win 501, options [nop,nop,TS val 2845907245 ecr 2973854222], length 204
07:14:16.589151 IP 146.190.244.30.22 > 76.64.103.178.51497: Flags [P.], seq 46273:46477, ack 0, win 501, options [nop,nop,TS val 2845907246 ecr 2973854222], length 204
07:14:16.589224 IP 146.190.244.30.22 > 76.64.103.178.51497: Flags [P.], seq 46477:46681, ack 0, win 501, options [nop,nop,TS val 2845907246 ecr 2973854222], length 204
07:14:16.589297 IP 146.190.244.30.22 > 76.64.103.178.51497: Flags [P.], seq 46681:46885, ack 0, win 501, options [nop,nop,TS val 2845907246 ecr 2973854222], length 204
07:14:16.589369 IP 146.190.244.30.22 > 76.64.103.178.51497: Flags [P.], seq 46885:47089, ack 0, win 501, options [nop,nop,TS val 2845907246 ecr 2973854222], length 204
07:14:16.589440 IP 146.190.244.30.22 > 76.64.103.178.51497: Flags [P.], seq 47089:47293, ack 0, win 501, options [nop,nop,TS val 2845907246 ecr 2973854222], length 204
07:14:16.589514 IP 146.190.244.30.22 > 76.64.103.178.51497: Flags [P.], seq 47293:47497, ack 0, win 501, options [nop,nop,TS val 2845907246 ecr 2973854222], length 204
07:14:16.589629 IP 146.190.244.30.22 > 76.64.103.178.51497: Flags [P.], seq 47497:47701, ack 0, win 501, options [nop,nop,TS val 2845907246 ecr 2973854222], length 204
07:14:16.589692 IP 146.190.244.30.22 > 76.64.103.178.51497: Flags [P.], seq 47701:47941, ack 0, win 501, options [nop,nop,TS val 2845907246 ecr 2973854222], length 240
07:14:16.589798 IP 146.190.244.30.22 > 76.64.103.178.51497: Flags [P.], seq 47941:48145, ack 0, win 501, options [nop,nop,TS val 2845907246 ecr 2973854222], length 204
07:14:16.589871 IP 146.190.244.30.22 > 76.64.103.178.51497: Flags [P.], seq 48145:48385, ack 0, win 501, options [nop,nop,TS val 2845907246 ecr 2973854222], length 240
07:14:16.589916 IP 146.190.244.30.22 > 76.64.103.178.51497: Flags [P.], seq 48385:48589, ack 0, win 501, options [nop,nop,TS val 2845907246 ecr 2973854222], length 204
07:14:16.589971 IP 146.190.244.30.22 > 76.64.103.178.51497: Flags [P.], seq 48589:48793, ack 0, win 501, options [nop,nop,TS val 2845907246 ecr 2973854222], length 204
07:14:16.590027 IP 146.190.244.30.22 > 76.64.103.178.51497: Flags [P.], seq 48793:48997, ack 0, win 501, options [nop,nop,TS val 2845907246 ecr 2973854222], length 204
07:14:16.590138 IP 146.190.244.30.22 > 76.64.103.178.51497: Flags [P.], seq 48997:49201, ack 0, win 501, options [nop,nop,TS val 2845907247 ecr 2973854222], length 204
07:14:16.590227 IP 146.190.244.30.22 > 76.64.103.178.51497: Flags [P.], seq 49201:49405, ack 0, win 501, options [nop,nop,TS val 2845907247 ecr 2973854222], length 204
07:14:16.590302 IP 146.190.244.30.22 > 76.64.103.178.51497: Flags [P.], seq 49405:49609, ack 0, win 501, options [nop,nop,TS val 2845907247 ecr 2973854222], length 204
07:14:16.590608 IP 146.190.244.30.22 > 76.64.103.178.51497: Flags [P.], seq 49609:49813, ack 0, win 501, options [nop,nop,TS val 2845907247 ecr 2973854222], length 204
07:14:16.590691 IP 146.190.244.30.22 > 76.64.103.178.51497: Flags [P.], seq 49813:50017, ack 0, win 501, options [nop,nop,TS val 2845907247 ecr 2973854222], length 204
07:14:16.590771 IP 146.190.244.30.22 > 76.64.103.178.51497: Flags [P.], seq 50017:50221, ack 0, win 501, options [nop,nop,TS val 2845907247 ecr 2973854222], length 204
07:14:16.590850 IP 146.190.244.30.22 > 76.64.103.178.51497: Flags [P.], seq 50221:50425, ack 0, win 501, options [nop,nop,TS val 2845907247 ecr 2973854222], length 204
07:14:16.591223 IP 146.190.244.30.22 > 76.64.103.178.51497: Flags [P.], seq 50425:50629, ack 0, win 501, options [nop,nop,TS val 2845907248 ecr 2973854222], length 204
07:14:16.591353 IP 146.190.244.30.22 > 76.64.103.178.51497: Flags [P.], seq 50629:50833, ack 0, win 501, options [nop,nop,TS val 2845907248 ecr 2973854222], length 204
07:14:16.591383 IP 76.64.103.178.51497 > 146.190.244.30.22: Flags [.], ack 39309, win 1990, options [nop,nop,TS val 2973854225 ecr 2845907242], length 0
07:14:16.591383 IP 76.64.103.178.51497 > 146.190.244.30.22: Flags [.], ack 39309, win 2048, options [nop,nop,TS val 2973854225 ecr 2845907242], length 0
07:14:16.591476 IP 146.190.244.30.22 > 76.64.103.178.51497: Flags [P.], seq 50833:50869, ack 0, win 501, options [nop,nop,TS val 2845907248 ecr 2973854225], length 36
07:14:16.591541 IP 146.190.244.30.22 > 76.64.103.178.51497: Flags [P.], seq 50869:51553, ack 0, win 501, options [nop,nop,TS val 2845907248 ecr 2973854225], length 684
07:14:16.591629 IP 146.190.244.30.22 > 76.64.103.178.51497: Flags [P.], seq 51553:51757, ack 0, win 501, options [nop,nop,TS val 2845907248 ecr 2973854225], length 204
07:14:16.591704 IP 146.190.244.30.22 > 76.64.103.178.51497: Flags [P.], seq 51757:51961, ack 0, win 501, options [nop,nop,TS val 2845907248 ecr 2973854225], length 204
07:14:16.591940 IP 146.190.244.30.22 > 76.64.103.178.51497: Flags [P.], seq 51961:52165, ack 0, win 501, options [nop,nop,TS val 2845907248 ecr 2973854225], length 204
